,Company,Valuation ($B),Year,Date Joined,Country,City,Industry,Investors,Number of investors,Count,Continent,latitude,longitude
650,Athelas,$1.50,2022,1/31/2022,United States,Mountain View,Health,"Sequoia Capital, General Catalyst, 	Human Capital",3,1,Europe,37.09024,-95.712891
651,ElasticRun,$1.50,2022,7/02/2022,India,Pune,"Supply chain, logistics, & delivery","Kalaari Capital, Norwest Venture Partners, Prosus Ventures",3,1,Asia,20.593684,78.96288
652,Veho,$1.50,2021,12/21/2021,United States,Boulder,"Supply chain, logistics, & delivery","General Catalyst, Origin Ventures, Fontinalis Partners",3,1,Europe,37.09024,-95.712891
653,Temporal,$1.50,2022,2/16/2022,United States,Bellevue,Internet software & services,"Amplify Partners, Addition, Madrona Venture Group",3,1,Europe,37.09024,-95.712891
654,Fabric,$1.50,2022,2/24/2022,United States,Bellevue,E-commerce & direct-to-consumer,"Redpoint Ventures, Norwest Venture Partners, Sierra Ventures",3,1,Europe,37.09024,-95.712891
655,Zeta,$1.50,2021,5/24/2021,United States,San Francisco,Fintech,"Sodexo Ventures, SoftBank Group",2,1,Europe,37.09024,-95.712891
656,Boba,$1.50,2022,5/04/2022,United States,San Francisco,Fintech,"DeFi Technologies, Hypersphere Ventures, M13",3,1,Europe,37.09024,-95.712891
657,Upside,$1.50,2022,4/26/2022,United States,DC,Mobile & telecommunications,"Bessemer Venture Partners, Builders VC, General Catalyst",3,1,Europe,37.09024,-95.712891
658,Mashgin,$1.50,2022,9/05/2022,United States,Palo Alto,Artificial intelligence,"New Enterprise Associates, Matrix Partmers, Susa Ventures",3,1,Europe,37.09024,-95.712891
659,Dock,$1.50,2022,12/05/2022,Brazil,Sao Paulo,Fintech,"Viking Global Investors, Riverwood Capital, Lightrock",3,1,Americas,-14.235004,-51.92528
660,Prometheus,$1.50,2021,9/23/2021,United States,Santa Cruz,Other,"BMW i Ventures, Metaplanet, Maersk Growth",3,1,Europe,37.09024,-95.712891
661,5ire,$1.50,2022,7/15/2022,United Kingdom,London,Internet software & services,"Global Emerging Markets, Sram & Mram Group, Marshland Capital",3,1,Asia,55.378051,-3.435973
662,Yipin Shengxian,$1.49,2019,11/03/2019,China,Hefei,E-commerce & direct-to-consumer,"Eastern Bell Capital, Capital Today, Longzhu Capital",3,1,Asia,35.86166,104.195397
663,Bordrin Motors,$1.48,2019,3/06/2019,China,Shanghai,Auto & transportation,"China Grand Prosperity Investment, CSC Group",2,1,Asia,35.86166,104.195397
664,Arcadia,$1.48,2022,10/05/2022,United States,DC,Other,"BoxGroup, Energy Impact Partners, Camber Creek",3,1,Europe,37.09024,-95.712891
665,Shukun Technology,$1.46,2021,8/16/2021,China,Beijing,Artificial Intelligence,"Marathon Venture Partners, Huagai Capital, China Creation Ventures",3,1,Asia,35.86166,104.195397
666,Coocaa,$1.45,2018,3/16/2018,China,Shenzhen,Hardware,"Baidu, Tencent Holdings",2,1,Asia,35.86166,104.195397
667,Juma Peisong,$1.45,2018,11/26/2018,China,Chengdu,"Supply chain, logistics, & delivery","Ding Xiang Capital, New Hope Fund, Sino-Ocean Capital",3,1,Asia,35.86166,104.195397
668,Ouyeel,$1.45,2019,6/27/2019,China,Shanghai,Internet software & services,Taigang Venture Capital,1,1,Asia,35.86166,104.195397
669,Gymshark,$1.45,2020,8/14/2020,United Kingdom,Solihull,E-commerce & direct-to-consumer,General Atlantic,1,1,Asia,55.378051,-3.435973
670,M1,$1.45,2021,7/14/2021,United States,Chicago,Fintech,"Left Lane Capital, Clocktower Technology Ventures, Jump Capital",3,1,Europe,37.09024,-95.712891
671,Aleo,$1.45,2022,7/02/2022,United States,San Francisco,Cybersecurity,"Slow Ventures, Andreessen Horowitz, SoftBank Group",3,1,Europe,37.09024,-95.712891
672,Einride,$1.44,2021,12/31/2021,Sweden,Stockholm,Auto & transportation,"Temasek,	BUILD Capital Partners, 	Northzone Ventures",3,1,Europe,60.128161,18.643501
673,Justworks,$1.43,2020,1/28/2020,United States,New York,Internet software & services,"Index Ventures, Thrive Capital, Bain Capital Ventures",3,1,Europe,37.09024,-95.712891
674,Valgen Medtech,$1.43,2021,6/05/2021,China,Hangzhou,Health,"Sequoia Capital China, China Life Investment Holding Company, Qiming Venture Partners",3,1,Asia,35.86166,104.195397
675,SonderMind,$1.42,2021,7/28/2021,United States,Denver,Health,"Kickstart Fund, General Catalyst, Drive Capital",3,1,Europe,37.09024,-95.712891
676,Papa,$1.40,2021,4/11/2021,United States,Miami,Health,"Initialized Capital, Canaan Partners, Sound Ventures",3,1,Europe,37.09024,-95.712891
677,Figment,$1.40,2021,12/20/2021,Canada,Toronto,Internet software & services,"Bonfire Ventures, Two Sigma Ventures, FJ Labs",3,1,Africa,56.130366,-106.346771
678,Envoy,$1.40,2022,11/01/2022,United States,San Francisco,Internet software & services,"Andreessen Horowitz, Initialized Capital, TriplePoint Capital",3,1,Europe,37.09024,-95.712891
679,Deliverect,$1.40,2022,1/24/2022,Belgium,Ghent,Fintech,"Newion Partners, SmartFin Capital, OMERS Ventures",3,1,Europe,50.503887,4.469936
680,SparkCognition,$1.40,2022,1/25/2022,United States,Austin,Artificial intelligence,"March Capital Partners, Temasek, Doha Venture Capital",3,1,Europe,37.09024,-95.712891
681,Firebolt,$1.40,2022,1/26/2022,Israel,Tel Aviv,Data management & analytics,"TLV Partners, Zeev Ventures, Bessemer Venture Partners",3,1,Asia,31.046051,34.851612
682,Koudai,$1.40,2014,10/23/2014,China,Beijing,E-commerce & direct-to-consumer,"New Enterprise Associates, Tiger Global management, Tencent",3,1,Asia,35.86166,104.195397
683,Symphony,$1.40,2017,5/16/2017,United States,New York,Fintech,"BNP Paribas, Goldman Sachs, Google",3,1,Europe,37.09024,-95.712891
684,Yidian Zixun,$1.40,2017,10/17/2017,China,Beijing,Mobile & telecommunications,"Phoenix New Media, Tianjin Haihe Industry Fund",2,1,Asia,35.86166,104.195397
685,Cabify,$1.40,2018,1/22/2018,Spain,Madrid,Auto & transportation,"Seaya Ventures, Otter Rock Capital, Rakuten",3,1,Europe,40.463667,-3.74922
686,Hive Box,$1.40,2018,1/23/2018,China,Shenzhen,"Supply chain, logistics, & delivery","Eastern Bell Capital, SF Holding Co, STO Express",3,1,Asia,35.86166,104.195397
687,Away,$1.40,2019,5/15/2019,United States,New York,E-commerce & direct-to-consumer,"Global Founders Capital, Comcast Ventures, Forerunner Ventures",3,1,Europe,37.09024,-95.712891
688,Kong,$1.40,2020,12/31/2020,United States,San Francisco,Internet software & services,"New Enterprise Associates, CRV, Index Ventures",3,1,Europe,37.09024,-95.712891
689,Epidemic Sound,$1.40,2021,11/03/2021,Sweden,Stockholm,Internet software & services,"EQT Partners, Blackstone",2,1,Europe,60.128161,18.643501
690,Yotpo,$1.40,2021,3/18/2021,United States,New York,Internet software & services,"Bessemer Venture Partners, Vintage Investment Partners, Blumberg Capital",3,1,Europe,37.09024,-95.712891
691,Rebel Foods,$1.40,2021,7/10/2021,India,Pune,E-commerce & direct-to-consumer,"Sequoia Capital India, Lightbox Ventures, Coatue Management",3,1,Asia,20.593684,78.96288
692,Coda,$1.40,2021,8/07/2021,United States,Mountain View,Internet software & services,"Greylock Partners, General Catalyst, Khosla Ventures",3,1,Europe,37.09024,-95.712891
693,Five Star Business Finance,$1.40,2021,3/26/2021,India,Chennai,Other,"Sequoia Capital India, Tiger Global Management, Tencent",3,1,Asia,20.593684,78.96288
694,Stash,$1.40,2021,3/02/2021,United States,New York,Fintech,"Goodwater Capital, Entree Capital, Valar Ventures",3,1,Europe,37.09024,-95.712891
695,Rad Power Bikes,$1.40,2021,10/28/2021,United States,Seattle,Auto & transportation,"Durable Capital Partners, Cercano Management, 	T. Rowe Price",3,1,Europe,37.09024,-95.712891
696,Clarify Health,$1.40,2022,5/04/2022,United States,San Francisco,Health,"KKR, Aspenwood Ventures, Spark Capital",3,1,Europe,37.09024,-95.712891
697,Bucketplace,$1.40,2022,9/05/2022,South Korea,Seoul,E-commerce & direct-to-consumer,"IMM Investment, Mirae Asset Capital, BOND",3,1,0,35.907757,127.766922
698,Paddle,$1.40,2022,9/05/2022,United Kingdom,London,Fintech,"Notion Capital, Kindred Capital, BGF Ventures",3,1,Asia,55.378051,-3.435973
699,OneCard,$1.40,2022,7/13/2022,India,Pune,Fintech,"Sequoia Capital India, Hummingbird Ventures, Matrix Partners India",3,1,Asia,20.593684,78.96288
700,Phenom People,$1.40,2021,7/04/2021,United States,Ambler,Internet software & services,"Sierra Ventures, AXA Venture Partners, Sigma Prime Ventures",3,1,Europe,37.09024,-95.712891
701,GupShup,$1.40,2021,8/04/2021,United States,San Francisco,Internet software & services,"Helion Venture Partners, Tiger Global management, CRV",3,1,Europe,37.09024,-95.712891
702,Degreed,$1.40,2021,4/13/2021,United States,Pleasanton,Edtech,"Signal Peak Ventures, Owl Ventures, Jump Capital",3,1,Europe,37.09024,-95.712891
703,Astranis Space Technologies,$1.40,2021,4/14/2021,United States,San Francisco,Mobile & telecommunications,"Refactor Capital, Andreessen Horowitz, Fifty Years Fund",3,1,Europe,37.09024,-95.712891
704,Scalable Capital,$1.40,2021,8/06/2021,Germany,Munich,Fintech,"BlackRock, Tengelmann Ventures, Holtzbrinck Ventures",3,1,Europe,51.165691,10.451526
705,VideoAmp,$1.40,2021,10/21/2021,United States,Los Angeles,Internet software & services,"Simon Equity Partners, Wavemaker Partners, Anthem Venture Partners",3,1,Europe,37.09024,-95.712891
706,Panther Labs,$1.40,2021,2/12/2021,United States,San Francisco,Cybersecurity,"Innovation Endeavors, s28 Capital, Lightspeed Venture Partners",3,1,Europe,37.09024,-95.712891
707,Salt Security,$1.40,2022,10/02/2022,United States,Palo Alto,Cybersecurity,"Y Combinator, S Capital, Tenaya Capital",3,1,Europe,37.09024,-95.712891
708,Tripledot,$1.40,2022,2/14/2022,United Kingdom,London,Mobile & telecommunications,"Lightspeed Venture Partners, Access Industries, Eldridge",3,1,Asia,55.378051,-3.435973
709,Nimble Rx,$1.40,2022,6/14/2022,United States,Redwood City,Health,"Sequoia Capital, Four Rivers Group, DAG Ventures",3,1,Europe,37.09024,-95.712891
710,Veepee,$1.38,2007,2/07/2007,France,La Plaine Saint-Denis,E-commerce & direct-to-consumer,"Summit Partners, Qatar Holding",2,1,Europe,46.227638,2.213749
711,Neon,$1.38,2022,2/14/2022,Brazil,Sao Paulo,Fintech,"Propel Venture Partners, Monashees+, BBVA",3,1,Americas,-14.235004,-51.92528
712,Movable Ink,$1.36,2022,4/28/2022,United States,New York,Internet software & services,"Contour Venture Partners, Intel Capital, Silver Lake",3,1,Europe,37.09024,-95.712891
713,DeepBlue Technology,$1.35,2018,4/16/2018,China,Shanghai,Artificial intelligence,"DESUN Capital, Yunfeng Capital, Meridian Capital",3,1,Asia,35.86166,104.195397
714,Klook,$1.35,2018,7/08/2018,Hong Kong,Central,Travel,"Sequoia Capital China, Goldman Sachs, Matrix Partners China",3,1,Asia,22.396428,114.109497
715,Yaoshibang,$1.35,2021,6/15/2021,China,Guangzhou,Health,"Green Pine Capital Partners, Ivy Capital, DCM Ventures",3,1,Asia,35.86166,104.195397
716,Alloy,$1.35,2021,9/30/2021,United States,New York,Fintech,"Bessemer Venture Partners, Eniac Ventures, Canapi Ventures",3,1,Europe,37.09024,-95.712891
717,Epirus,$1.35,2022,2/14/2022,United States,Hawthorne,Other,"8VC, Bedrock Capital, Broom Ventures",3,1,Europe,37.09024,-95.712891
718,Signifyd,$1.34,2021,4/15/2021,United States,San Jose,Fintech,"Menlo Ventures, Resolute Ventures, IA Ventures",3,1,Europe,37.09024,-95.712891
719,Jaguar Microsystems,$1.34,2022,6/23/2022,China,Shenzhen,Hardware,"Tencent Holdings, Glory Ventures, Shenzhen Capital Group",3,1,Asia,35.86166,104.195397
720,Motorway,$1.33,2021,11/29/2021,United Kingdom,London,E-commerce & direct-to-consumer,"Marchmont Ventures, BMW i Ventures, Index Ventures",3,1,Asia,55.378051,-3.435973
721,RIDI,$1.33,2022,1/24/2022,South Korea,Seoul,E-commerce & direct-to-consumer,"Atinum Investment, Company K Partners, GIC",3,1,0,35.907757,127.766922
722,Flipboard,$1.32,2015,7/22/2015,United States,Palo Alto,Internet software & services,"Kleiner Perkins Caufield & Byers, Comcast Ventures, Insight Partners",3,1,Europe,37.09024,-95.712891
723,GPclub,$1.32,2018,10/22/2018,South Korea,Seoul,Other,Goldman Sachs,1,1,0,35.907757,127.766922
724,Tongdun Technology,$1.32,2019,4/25/2019,China,Hangzhou,Cybersecurity,"Advantech Capital, Temasek Holdings Ltd., Tiantu Capital Co.",3,1,Asia,35.86166,104.195397
725,Athletic Greens,$1.32,2022,1/25/2022,United States,New York,Health,"SC.Holdings, Not Boring Capital, Bolt Ventures",3,1,Europe,37.09024,-95.712891
726,Unisound,$1.31,2018,7/19/2018,China,Beijing,Artificial intelligence,"Qiming Venture Partners, China Internet Investment Fund, Qualcomm Ventures",3,1,Asia,35.86166,104.195397
727,Alzheon,$1.31,2020,9/30/2020,United States,Framingham,Health,"ARCH Venture Partners, Ally Bridge Group",2,1,Europe,37.09024,-95.712891
728,HeartFlow,$1.30,2017,4/12/2017,United States,Redwood City,Health,"BlueCross BlueShield Venture Partners, US Venture Partners",2,1,Europe,37.09024,-95.712891
729,Shiprocket,$1.30,2022,8/16/2022,India,New Delhi,Internet,"Bertelsmann India Investments, March Capital Partners, Tribe Capital, Nirvana Venture Advisors",4,1,Asia,20.593684,78.96288
730,The Brandtech Group,$1.30,2019,11/19/2019,United States,New York,Other,Undisclosed,1,1,Europe,37.09024,-95.712891
731,InSightec,$1.30,2020,6/03/2020,Israel,Tirat Carmel,Health,"York Capital Management, GE Healthcare, Koch Disruptive Technologies",3,1,Asia,31.046051,34.851612
732,Everly Health,$1.30,2020,3/12/2020,United States,Austin,Health,"Highland Capital Partners, Next Coast Ventures, SoGal Ventures",3,1,Europe,37.09024,-95.712891
733,Manner,$1.30,2020,12/24/2020,China,Shanghai,Other,"Coatue Management, H Capital, Capital Today",3,1,Asia,35.86166,104.195397
734,TalkingData,$1.30,2021,6/01/2021,China,Beijing,Mobile & telecommunications,"N5 Capital, CR Capital Mgmt, JD Digits",3,1,Asia,35.86166,104.195397
735,DistroKid,$1.30,2021,8/16/2021,United States,New York,Internet software & services,"Insight Partners, Silversmith Capital Partners, Spotify",3,1,Europe,37.09024,-95.712891
736,Konfio,$1.30,2021,9/29/2021,Mexico,Mexico City,Fintech,"Kaszek Ventures, QED Investors, International Finance Corporation",3,1,Americas,23.634501,-102.552784
737,Betterment,$1.30,2021,9/29/2021,United States,New York,Fintech,"Bessemer Venture Partners, Menlo Ventures, Anthermis",3,1,Europe,37.09024,-95.712891
738,Flock Freight,$1.30,2021,10/20/2021,United States,Encinitas,"Supply chain, logistics, & delivery","SignalFire, GLP Capital Partners, Google Ventures",3,1,Europe,37.09024,-95.712891
739,YugaByte,$1.30,2021,10/28/2021,United States,Sunnyvale,Data management & analytics,"Lightspeed Venture Partners, Dell Technologies Capital, Wipro Ventures",3,1,Europe,37.09024,-95.712891
740,Lukka,$1.30,2022,1/14/2022,United States,New York,Fintech,"Liberty City Ventures, Soros Fund Management, Summer Capital",3,1,Europe,37.09024,-95.712891
741,TravelPerk,$1.30,2022,12/01/2022,Spain,Barcelona,Travel,"LocalGlobe, Kinnevik, Felix Capital",3,1,Europe,40.463667,-3.74922
742,iTrustCapital,$1.30,2022,11/01/2022,United States,Long Beach,Fintech,"Left Lane Capital, Walden Venture Capital",2,1,Europe,37.09024,-95.712891
743,Domestika,$1.30,2022,1/27/2022,United States,Berkeley,Internet software & services,"Zeev Ventures, GSV Ventures",2,1,Europe,37.09024,-95.712891
744,CoinTracker,$1.30,2022,1/27/2022,United States,San Francisco,Fintech,"Initialized Capital, General Catalyst, Kraken Ventures",3,1,Europe,37.09024,-95.712891
745,Loadsmart,$1.30,2022,1/02/2022,United States,New York,"Supply chain, logistics, & delivery","Chromo Invest, Maersk Growth, BlackRock",3,1,Europe,37.09024,-95.712891
746,TUNGEE,$1.30,2021,12/15/2021,China,Guangzhou,Artificial Intelligence,"UNITY VENTURES, Qiming Venture Partners, GGV Capital",3,1,Asia,35.86166,104.195397
747,CredAvenue,$1.30,2022,7/03/2022,India,Chennai,Fintech,"Insight Partners, B Capital Group, 	Lightspeed Venture Partners",3,1,Asia,20.593684,78.96288
748,LinkTree,$1.30,2022,3/16/2022,Australia,Melbourne,Internet software & services,"AirTree Ventures, Insight Partners, Index Ventures",3,1,Oceania,-25.274398,133.775136
749,Island,$1.30,2022,3/23/2022,United States,Dallas,Internet software & services,"Insight Partners, Sequoia Capital, Stripes Group",3,1,Europe,37.09024,-95.712891
750,Clipboard Health,$1.30,2022,1/02/2022,United States,San Francisco,Internet software & services,"Caffeinated Capital, Initialized Capital, Y Combinator",3,1,Europe,37.09024,-95.712891
751,Biofourmis,$1.30,2022,4/26/2022,United States,Boston,Health,"General Atlantic, CVS Health, MassMutual Ventures",3,1,Europe,37.09024,-95.712891
752,STORD,$1.30,2021,9/13/2021,United States,Atlanta,"Supply chain, logistics, & delivery","Dynamo VC, Susa Ventures, Founders Fund",3,1,Europe,37.09024,-95.712891
753,Optibus,$1.30,2022,5/16/2022,Israel,Tel Aviv,"Supply chain, logistics, & delivery","Bessemer Venture Partners, Insight Partners, Pitango Venture Capital",3,1,Asia,31.046051,34.851612
754,Intercom,$1.28,2018,3/27/2018,United States,San Francisco,Internet software & services,"FirstMark Capital, Tiger Global Management",2,1,Europe,37.09024,-95.712891
755,OVO Energy,$1.28,2019,2/14/2019,United Kingdom,Bristol,Other,"Mitsubishi Corporation, Mayfair Equity Partners",2,1,Asia,55.378051,-3.435973
756,Huisuanzhang,$1.28,2021,5/24/2021,China,Beijing,Fintech,"IDG Capital, Gaocheng Capital, Chuanrong Capital",3,1,Asia,35.86166,104.195397
757,WTOIP,$1.27,2018,8/04/2018,China,Guangzhou,Internet software & services,"Dark Horse Technology Group, Hopu Investment Management, Kefa Capital",3,1,Asia,35.86166,104.195397
758,Greater Bay Technology,$1.26,2022,2/04/2022,China,Guangzhou,Hardware,"Tencent Holdings, Utrust Venture Capital, GF Xinde Investment Management Co.",3,1,Asia,35.86166,104.195397
759,JMGO,$1.26,2022,3/15/2022,China,Shenzhen,Hardware,"IDG Capital, Yuanda Venture Investment, Primitive Forest Holdings Group",3,1,Asia,35.86166,104.195397
760,BigID,$1.25,2020,12/16/2020,United States,New York,Cybersecurity,"BOLDstart Ventures, SAP.iO Fund, Scale Venture Partners",3,1,Europe,37.09024,-95.712891
761,Kuaikan Manhua,$1.25,2017,1/12/2017,China,Beijing,Internet software & services,"Sequoia Capital China, CMC Capital Partners, Tencent Holdings",3,1,Asia,35.86166,104.195397
762,Marshmallow,$1.25,2021,8/09/2021,United Kingdom,London,Fintech,"Passion Capital, Hedosophia, Outrun Ventures",3,1,Asia,55.378051,-3.435973
763,Honor Technology,$1.25,2021,5/10/2021,United States,San Francisco,Internet software & services,"Andreessen Horowitz, Prosus Ventures, Thrive Capital",3,1,Europe,37.09024,-95.712891
764,Mythical Games,$1.25,2021,4/11/2021,United States,Sherman Oaks,Internet software & services,"Javelin Venture Partners, Struck Capital, Alumni Ventures Group",3,1,Europe,37.09024,-95.712891
765,Incode Technologies,$1.25,2021,7/12/2021,United States,San Francisco,Cybersecurity,"Dila Capital, Framework Ventures, 3L",3,1,Europe,37.09024,-95.712891
766,Tackle.io,$1.25,2021,12/21/2021,United States,Boise,Internet software & services,"Andreessen Horowitz, Bessemer Venture Partners, Coatue Management",3,1,Europe,37.09024,-95.712891
767,Flipdish,$1.25,2022,1/13/2022,Ireland,Dublin,Internet software & services,"Tencent Holdings, Tiger Global Management, Global Founders Capital",3,1,Europe,53.41291,-8.24389
768,Route,$1.25,2022,1/21/2022,United States,Lehi,"Supply chain, logistics, & delivery","Madrona Venture Group, Banner Ventures, FJ Labs",3,1,Europe,37.09024,-95.712891
769,CaptivateIQ,$1.25,2022,1/26/2022,United States,San Francisco,Fintech,"Sequoia Capital, Y Combinator, Accel",3,1,Europe,37.09024,-95.712891
770,Talos,$1.25,2022,10/05/2022,United States,New York,Fintech,"Castle Island Ventures, PayPal Ventures, Andreessen Horowitz",3,1,Europe,37.09024,-95.712891
771,airSlate,$1.25,2022,6/16/2022,United States,Brookline,Internet software & services,"G Squared, UiPath Ventures, General Catalyst",3,1,Europe,37.09024,-95.712891
772,ClassDojo,$1.25,2022,7/21/2022,United States,San Francisco,Edtech,"General Catalyst, Unkork Capital, Tencent Holdings",3,1,Europe,37.09024,-95.712891
773,BrewDog,$1.24,2017,10/04/2017,United Kingdom,Aberdeen,Consumer & retail,"TSG Consumer Partners, Crowdcube",2,1,Asia,55.378051,-3.435973
774,Enflame,$1.24,2021,5/01/2021,China,Shanghai,Hardware,"Tencent Holdings, Delta Capital, Redpoint Ventures China",3,1,Asia,35.86166,104.195397
775,Shulan Health,$1.24,2021,1/03/2021,China,Hangzhou,Health,Qiming Venture Partners,1,1,Asia,35.86166,104.195397
776,EQRx,$1.23,2021,11/01/2021,United States,Cambridge,Health,"Nextech Invest, Casdin Capital, Google Ventures",3,1,Europe,37.09024,-95.712891
777,Nexii,$1.23,2021,8/09/2021,Canada,Vancouver,Other,"Trane Technologies, Honeywell",2,1,Africa,56.130366,-106.346771
778,inDriver,$1.23,2021,1/02/2021,United States,Mountain View,Auto & transportation,"Leta Capital, Insight Partners, General Catalyst",3,1,Europe,37.09024,-95.712891
779,GalaxySpace,$1.22,2020,11/17/2020,China,Beijing,Mobile & telecommunications,"Shunwei Capital Partners, 5Y Capital, Legend Capital",3,1,Asia,35.86166,104.195397
780,Spiber,$1.22,2021,8/09/2021,Japan,Tsuruoka,Other,"Cool Japan Fund, JAFCO, The Carlyle Group",3,1,Asia,36.204824,138.252924
781,Insider,$1.22,2022,2/28/2022,Turkey,Istanbul,Internet software & services,"Wamda Capital, Endeavor, Riverwood Capital",3,1,Asia,38.963745,35.243322
782,Kallyope,$1.22,2022,2/15/2022,United States,New York,Health,"The Column Group, Alexandria Venture Investments, Lux Capital",3,1,Europe,37.09024,-95.712891
783,Zip,$1.20,2022,5/25/2022,United States,San Francisco,Fintech,"CRV, Tiger Global Management, Y Combinator",3,1,Europe,37.09024,-95.712891
784,Yiguo,$1.20,2016,9/11/2016,China,Shanghai,"Supply chain, logistics, & delivery","Alibaba Group, KKR, Goldman Sachs",3,1,Asia,35.86166,104.195397
785,Fair,$1.20,2018,12/20/2018,United States,Santa Monica,Auto & transportation,"CreditEase Fintech Investment Fund, BMW i Ventures, SoftBank Group",3,1,Europe,37.09024,-95.712891
786,Glossier,$1.65,2019,3/19/2019,United States,New York,Consumer & retail,"Forerunner Ventures, Institutional Venture Partners, Thrive Capital",3,1,Europe,37.09024,-95.712891
787,Workhuman,$1.20,2020,6/23/2020,Ireland,Dublin,Internet software & services,ICG,1,1,Europe,53.41291,-8.24389
788,Qumulo,$1.20,2020,7/16/2020,United States,Seattle,Data management & analytics,"Madrona Venture Group, Kleiner Perkins Caufield & Byers, Highland Capital Partners",3,1,Europe,37.09024,-95.712891
789,Tealium,$1.20,2021,3/02/2021,United States,San Diego,Internet software & services,"Georgian Partners, Silver Lake, Presidio Ventures",3,1,Europe,37.09024,-95.712891
790,Public,$1.20,2021,2/17/2021,United States,New York,Fintech,"Accel, Greycroft, Advancit Capital",3,1,Europe,37.09024,-95.712891
791,Pipa Coding,$1.20,2021,3/25/2021,China,Beijing,Edtech,"Source Code Capital, XVC Venture Capital, Hillhouse Capital Management",3,1,Asia,35.86166,104.195397
792,Pilot.com,$1.20,2021,3/26/2021,United States,San Francisco,Fintech,"Index Ventures, Sequoia Capital, Bezos Expeditions",3,1,Europe,37.09024,-95.712891
793,Aibee,$1,2021,4/13/2021,China,Beijing,Artificial intelligence,"Sequoia Capital China, Lenovo Capital and Incubator, Group GSR Ventures",3,1,Asia,35.86166,104.195397
794,Cava Group,$1.30,2021,4/27/2021,United States,Washington,Other,"SWaN & Legend Ventures, Revolution Growth, Invus Group",3,1,Europe,37.09024,-95.712891
795,Vectra Networks,$1.20,2021,4/29/2021,United States,San Jose,Artificial intelligence,"IA Ventures, Khosla Ventures, AME Cloud Ventures",3,1,Europe,37.09024,-95.712891
796,Ada Support,$1.20,2021,7/05/2021,Canada,Toronto,Artificial intelligence,"Version One Ventures, Bessemer Venture Partners, FirstMark Capital",3,1,Africa,56.130366,-106.346771
797,Inari,$1.20,2021,12/05/2021,United States,Cambridge,Other,"Flagship Pioneering, Alexandria Venture Investments, Investment Corporation of Dubai",3,1,Europe,37.09024,-95.712891
798,Alation,$1.20,2021,3/06/2021,United States,Redwood City,Internet software & services,"Costanoa Ventures, Data Collective, Salesforce Ventures",3,1,Europe,37.09024,-95.712891
799,SmartMore,$1.20,2021,6/24/2021,China,Shenzhen,Artificial Intelligence,"IDG Capital, ZhenFund, Sequoia Capital China",3,1,Asia,35.86166,104.195397
800,Rohlik Group,$1.20,2021,1/07/2021,Czech Republic,Prague,"Supply chain, logistics, & delivery","Partech Partners, Index Ventures, Quadrille Capital",3,1,Europe,49.817492,15.472962
801,Prime Medicine,$1.20,2021,7/13/2021,United States,Cambridge,Health,"Newpath Partners, Google Ventures, F-Prime Capital",3,1,Europe,37.09024,-95.712891
802,FloQast,$1.20,2021,7/21/2021,United States,Los Angeles,Fintech,"Polaris Partners, Insight Partners, Norwest Venture Partners",3,1,Europe,37.09024,-95.712891
803,MindTickle,$1.20,2021,3/08/2021,United States,San Francisco,Internet software & services,"Qualcomm Ventures, Accel, Canaan Partners",3,1,Europe,37.09024,-95.712891
804,DailyPay,$1.20,2021,5/18/2021,United States,New York,Fintech,"RPM Ventures, Inspiration Ventures, Carrick Capital Partners",3,1,Europe,37.09024,-95.712891
805,Oda,$1.20,2021,2/06/2021,Norway,Oslo,E-commerce & direct-to-consumer,"Kinnevik, Softbank Group, Prosus Ventures",3,1,Europe,60.472024,8.468946
806,Offchain Labs,$1.20,2021,8/31/2021,United States,Princeton,Internet software & services,"Pantera Capital, Polychain Capital, Lightspeed Venture Partners",3,1,Europe,37.09024,-95.712891
807,Copado,$1.20,2021,9/13/2021,United States,Chicago,Data management & analytics,"Insight Partners, Salesforce Ventures, Perpetual Investors",3,1,Europe,37.09024,-95.712891
808,Gem,$1.20,2021,9/28/2021,United States,San Francisco,Internet software & services,"Accel, Greylock Partners, Meritech Capital Partners",3,1,Europe,37.09024,-95.712891
809,CarDekho,$1.20,2021,10/13/2021,India,Jaipur,E-commerce & direct-to-consumer,"Sequoia Capital India, Hillhouse Capital Management, Sunley House Capital Management",3,1,Asia,20.593684,78.96288
810,MyGlamm,$1.20,2021,10/11/2021,India,Mumbai,E-commerce & direct-to-consumer,"L'Occitane, Trifecta Capital, Bessemer Venture Partners",3,1,Asia,20.593684,78.96288
