,Company,Valuation ($B),Year,Date Joined,Country,City,Industry,Investors,Number of investors,Count,Continent,latitude,longitude
811,AgentSync,$1.20,2021,7/12/2021,United States,Denver,Fintech,"Craft Ventures, Caffeinated Capital, Operator Collective",3,1,Europe,37.09024,-95.712891
812,Pristyn Care,$1.40,2021,7/12/2021,India,Gurugram,Health,"Sequoia Capital India, Hummingbird Ventures, Epiq Capital",3,1,Asia,20.593684,78.96288
813,Jokr,$1.20,2021,2/12/2021,United States,New York,"Supply chain, logistics, & delivery","GGV Capital, Tiger Global Management, Greycroft",3,1,Europe,37.09024,-95.712891
814,Merama,$1.20,2021,9/12/2021,Mexico,Mexico City,E-commerce & direct-to-consumer,"SoftBank Latin America Fund, Advent International, Balderton Capital",3,1,Americas,23.634501,-102.552784
815,SeekOut,$1.20,2022,12/01/2022,United States,Bellevue,Internet software & services,"Mayfield, Madrona Venture Group, Tiger Global Management",3,1,Europe,37.09024,-95.712891
816,BigPanda,$1.20,2022,12/01/2022,United States,Mountain View,Artificial intelligence,"Advent International, Battery Ventures, Sequoia Capital Israel",3,1,Europe,37.09024,-95.712891
817,Phantom,$1.20,2022,1/31/2022,United States,San Francisco,Fintech,"Paradigm, Andreessen Horowitz, Jump Capital",3,1,Europe,37.09024,-95.712891
818,LivSpace,$1.20,2022,8/02/2022,India,Bengaluru,E-commerce & direct-to-consumer,"Jungle Ventures, Helion Venture Partners, INGKA Investments",3,1,Asia,20.593684,78.96288
819,Xpressbees,$1.20,2022,9/02/2022,India,Pune,"Supply chain, logistics, & delivery","Norwest Venture Partners, Investcorp, Blackstone",3,1,Asia,20.593684,78.96288
820,Nova Labs,$1.20,2022,2/22/2022,United States,San Francisco,Internet software & services,"FirstMark Capital, Tiger Global Management, FTX Venture",3,1,Europe,37.09024,-95.712891
821,Choco,$1.20,2022,12/04/2022,Germany,Berlin,E-commerce & direct-to-consumer,"Bessemer Venture Partners, G Squared, Insight Partners",3,1,Europe,51.165691,10.451526
822,Viz.ai,$1.20,2022,7/04/2022,United States,San Francisco,Artificial Intelligence,"Kleiner Perkins Caufield & Byers, CRV, Threshold Ventures",3,1,Europe,37.09024,-95.712891
823,Unit,$1.20,2022,5/17/2022,United States,New York,Fintech,"Accel, Better Tomorrow Ventures, Flourish Ventures",3,1,Europe,37.09024,-95.712891
824,stori,$1.20,2022,7/15/2022,Mexico,Juarez,Fintech,"Vision Plus Capital, 	Source Code Capital, Lightspeed Venture Partners",3,1,Americas,23.634501,-102.552784
825,Spectrum Medical,$1.20,2022,7/18/2022,United Kingdom,Gloucester,Health,CVC Capital Partners,1,1,Asia,55.378051,-3.435973
826,CloudBees,$1.15,2021,9/12/2021,United States,San Jose,Data management & analytics,"Matrix Partners, Lightspeed Venture Partners, Verizon Ventures",3,1,Europe,37.09024,-95.712891
827,L&P Cosmetic,$1.19,2016,1/01/2016,South Korea,Seoul,Consumer & retail,CDIB Capital,1,1,0,35.907757,127.766922
828,Mininglamp Technology,$1.19,2019,3/27/2019,China,Beijing,Artificial intelligence,"Russia-China Investment Fund, Tencent Holdings, Sequoia Capital China",3,1,Asia,35.86166,104.195397
829,Luoji Siwei,$1.18,2017,7/20/2017,China,Beijing,Edtech,"Sequoia Capital China, Qiming Venture Partners, Tencent Holdings",3,1,Asia,35.86166,104.195397
830,Yimidida,$1.17,2019,1/14/2019,China,Shanghai,"Supply chain, logistics, & delivery","Source Code Capital, Global Logistic Properties, K2VC",3,1,Asia,35.86166,104.195397
831,Modern Health,$1.17,2021,11/02/2021,United States,San Francisco,Health,"Kleiner Perkins Caufield & Byers, Afore Capital, Founders Fund",3,1,Europe,37.09024,-95.712891
832,IRL,$1.17,2021,6/15/2021,United States,San Francisco,Internet software & services,"Goodwater Capital, Floodgate, Founders Fund",3,1,Europe,37.09024,-95.712891
833,Tuhu,$1.16,2018,9/15/2018,China,Shanghai,Auto & transportation,"Qiming Venture Partners, Yaxia Automobile, Far East Horizon",3,1,Asia,35.86166,104.195397
834,SOURCE Global,$1.16,2022,4/29/2022,United States,Scottsdale,Other,"Breakthrough Energy Ventures, Material Impact, 3x5 Special Opportunity Partners",3,1,Europe,37.09024,-95.712891
835,LifeMiles,$1.15,2015,7/13/2015,Colombia,Bogota,Other,Advent International,1,1,Americas,4.570868,-74.297333
836,Venafi,$1.15,2020,10/12/2020,United States,Salt Lake City,Cybersecurity,"Pelion Venture Partners, Foundation Capital, Thoma Bravo",3,1,Europe,37.09024,-95.712891
837,Guideline,$1.15,2021,6/16/2021,United States,San Mateo,Fintech,"Pelion Venture Partners, Foundation Capital, Thoma Bravo",3,1,Europe,37.09024,-95.712891
838,Rebellion Defense,$1.15,2021,9/16/2021,United States,Washington DC,Artificial intelligence,"Venrock, Innovation Endeavors, Insights Partners",3,1,Europe,37.09024,-95.712891
839,Elemy,$1.15,2021,6/10/2021,United States,San Francisco,Health,"General Catalyst, Bling Capital, Felicis Ventures",3,1,Europe,37.09024,-95.712891
840,Happy Money,$1.15,2022,8/02/2022,United States,Tustin,Fintech,"FirstMark Capital, Anthemis, CMFG Ventures",3,1,Europe,37.09024,-95.712891
841,TELD,$1.12,2019,12/16/2019,China,Qingdao,Fintech,"China Reform Fund, Gaopeng Capital, Jinhui Xingye",3,1,Asia,35.86166,104.195397
842,DANA,$1.13,2022,10/08/2022,Indonesia,Jakarta,Fintech,"Ant Group, Lazada, Sinar Mas Indonesia",3,1,Asia,-0.789275,113.921327
843,At-Bay,$1.12,2021,7/27/2021,United States,Mountain View,Fintech,"Lightspeed Venture Partners, Khosla Ventures, Munich Re Ventures",3,1,Europe,37.09024,-95.712891
844,Visby Medical,$1.12,2022,1/03/2022,United States,San Jose,Health,"Artiman Ventures, Pitango Venture Capital, Valo Ventures",3,1,Europe,37.09024,-95.712891
845,Invoca,$1.10,2022,6/14/2022,United States,Santa Barbara,Artificial intelligence,"Upfront Ventures, Accel, Industry Ventures",3,1,Europe,37.09024,-95.712891
846,TangoMe,$1.10,2014,3/20/2014,United States,Mountain View,Mobile & telecommunications,"Draper Fisher Jurtson, Qualcomm Ventures, Alibaba Group",3,1,Europe,37.09024,-95.712891
847,AppDirect,$1.10,2015,7/10/2015,United States,San Francisco,E-commerce & direct-to-consumer,"Mithril, iNovia Capital, Foundry Group",3,1,Europe,37.09024,-95.712891
848,Juanpi,$1.10,2016,4/14/2016,China,Wuhan,E-commerce & direct-to-consumer,"Tiantu Capital, SAIF Partners China, Newsion Venture Capital",3,1,Asia,35.86166,104.195397
849,OVH,$1.10,2016,8/15/2016,France,Roubaix,Other,"KKR, TowerBrook Capital Partners",2,1,Europe,46.227638,2.213749
850,GetYourGuide,$1.10,2019,5/16/2019,Germany,Berlin,Travel,"Spark Capital, Highland Europe, Sunstone Capital",3,1,Europe,51.165691,10.451526
851,Ivalua,$1.10,2019,5/21/2019,United States,Redwood City,Fintech,"Ardian, Tiger Global Management, KKR",3,1,Europe,37.09024,-95.712891
852,Sisense,$1.10,2020,9/01/2020,United States,New York,Data management & analytics,"Opus Capital, Genesis Partners, Battery Ventures",3,1,Europe,37.09024,-95.712891
853,Pharmapacks,$1.10,2020,12/11/2020,United States,Islandia,E-commerce & direct-to-consumer,The Carlyle Group,1,1,Europe,37.09024,-95.712891
854,Sennder,$1.10,2021,1/14/2021,Germany,Berlin,"Supply chain, logistics, & delivery","Accelm Scania Growth Capital, Lakestar",2,1,Europe,51.165691,10.451526
855,Nexthink,$1.10,2021,8/02/2021,Switzerland,Prilly,Data management & analytics,"Auriga, Galeo Ventures, Highland Europe",3,1,Europe,46.818188,8.227512
856,Zego,$1.10,2021,9/03/2021,United Kingdom,London,Fintech,"LocalGlobe, Balderton Capital, Target Global",3,1,Asia,55.378051,-3.435973
857,Rightway,$1.10,2021,3/30/2021,United States,New York,Health,"Thrive Capital, Khosla Ventures, Tiger Global Management",3,1,Europe,37.09024,-95.712891
858,Sunbit,$1.10,2021,5/20/2021,United States,Los Angeles,Fintech,"Zeev Ventures, Group11, Chicago Ventures",3,1,Europe,37.09024,-95.712891
859,Qingting FM,$1.10,2021,2/06/2021,China,Shanghai,Internet software & services,"China Culture Industrial Investment Fund, We Capital, China Minsheng Investment Group",3,1,Asia,35.86166,104.195397
860,G2,$1.10,2021,6/22/2021,United States,Chicago,Internet software & services,"Pritzker Group Venture Capital, Accel, Hyde Park Venture Partners",3,1,Europe,37.09024,-95.712891
861,Hailo,$1,2021,12/10/2021,Israel,Tel Aviv,Artificial intelligence,"Glory Ventures, Maniv Mobility",2,1,Asia,31.046051,34.851612
862,Caribou,$1.10,2022,5/23/2022,United States,Denver,Fintech,"CMFG Ventures, Accomplice, Moderne Ventures",3,1,Europe,37.09024,-95.712891
863,Nowports,$1.10,2022,5/24/2022,Mexico,Monterrey,"Supply chain, logistics, & delivery","Monashees+, Foundation Capital, Base10 Partners",3,1,Americas,23.634501,-102.552784
864,People.ai,$1.10,2021,11/08/2021,United States,San Francisco,Internet software & services,"GGV Capital, Lightspeed Venture Partners, ICONIQ Capital",3,1,Europe,37.09024,-95.712891
865,Carousell,$1.10,2021,9/15/2021,Singapore,E-commerce & direct-to-consumer,"500 Global, Rakuten Ventures, Golden Gate Ventures",,1,1,Asia,1.352083,103.819836
866,apna,$1.10,2021,9/15/2021,India,Bengaluru,Internet software & services,"Sequoia Capital India, Rocketship.vc, Lightspeed India Partners",3,1,Asia,20.593684,78.96288
867,Karat,$1.10,2021,10/13/2021,United States,Seattle,Internet software & services,"8VC, Norwest Venture Partners, Tiger Global Management",3,1,Europe,37.09024,-95.712891
868,Enpal,$1.10,2021,10/18/2021,Germany,Berlin,Internet software & services,"HV Capital, Softbank Group, BlackRock",3,1,Europe,51.165691,10.451526
869,Acko General Insurance,$1.10,2021,10/28/2021,India,Bengaluru,Fintech,"Intact Ventures, Munich Re Ventures, General Atlantic",3,1,Asia,20.593684,78.96288
870,Daily Harvest,$1.10,2021,11/16/2021,United States,New York,E-commerce & direct-to-consumer,"M13, Lightspeed Venture Partners, Lone Pine Capital",3,1,Europe,37.09024,-95.712891
871,The Bank of London,$1.10,2021,11/30/2021,United Kingdom,London,Fintech,"Mangrove Capital Partners,14W. ForgeLight",2,1,Asia,55.378051,-3.435973
872,Fundbox,$1.10,2021,11/30/2021,United States,San Francisco,Fintech,"Khosla Ventures, General Catalyst, Blumberg Capital",3,1,Europe,37.09024,-95.712891
873,Turing,$1.10,2021,12/20/2021,United States,Palo Alto,Internet software & services,"Foundation Capital, 	Frontier Ventures, AltaIR Capital",3,1,Europe,37.09024,-95.712891
874,GlobalBees,$1.10,2021,12/28/2021,India,New Delhi,E-commerce & direct-to-consumer,"Chiratae Ventures, SoftBank Group, Trifecta Capital",3,1,Asia,20.593684,78.96288
875,LEAD School,$1.10,2022,1/13/2022,India,Andheri,Edtech,"WestBridge Capital, GSV Ventures, Elevar Equity",3,1,Asia,20.593684,78.96288
876,eSentire,$1.10,2022,2/22/2022,Canada,Waterloo,Cybersecurity,"Edison Partners, Georgian Partners, VentureLink",3,1,Africa,56.130366,-106.346771
877,Beyond Identity,$1.10,2022,2/22/2022,United States,New York,Cybersecurity,"New Enterprise Associates, Koch Disruptive Technologies, Evolution Equity Partners",3,1,Europe,37.09024,-95.712891
878,Staffbase,$1.10,2022,3/15/2022,Germany,Chemnitz,Internet software & services,"Insight Partners, e.ventures, General Atlantic",3,1,Europe,51.165691,10.451526
879,Chief,$1.10,2022,3/31/2022,United States,New York,Other,"General Catalyst, Inspired Capital, Flybridge Capital Partners",3,1,Europe,37.09024,-95.712891
880,IntelyCare,$1.10,2022,6/04/2022,United States,Quincy,Health,"Kaiser Permanente Ventures, Endeavour Vision, LRVHealth",3,1,Europe,37.09024,-95.712891
881,Teleport,$1.10,2022,3/05/2022,United States,Oakland,Cybersecurity,"Kleiner Perkins Caufield & Byers, s28 Capital, Insight Partners",3,1,Europe,37.09024,-95.712891
882,Imply Data,$1.10,2022,5/17/2022,United States,Burlingame,Data management & analytics,"Andreessen Horowitz, Bessemer Venture Partners, Khosla Ventures,",4,1,Europe,37.09024,-95.712891
883,Material Security,$1.10,2022,11/05/2022,United States,Redwood City,Cybersecurity,"Andreessen Horowitz, Founders Fund",2,1,Europe,37.09024,-95.712891
884,PhysicsWallah,$1.10,2022,7/06/2022,India,Uttar Pradesh,Edtech,"GSV Ventures, WestBridge Capital",2,1,Asia,20.593684,78.96288
885,Recover,$1.10,2022,9/06/2022,Spain,Banyeres de Mariola,Other,"Goldman Sachs Asset Management, STORY3 Capital Partners",2,1,Europe,40.463667,-3.74922
886,Purplle,$1.10,2022,9/06/2022,India,Mumbai,E-commerce & direct-to-consumer,"Blume Ventures, JSW Ventures, IvyCap Ventures",3,1,Asia,20.593684,78.96288
887,CAIS,$1.10,2022,11/01/2022,United States,New York,Fintech,"Franklin Templeton, Motive Partners. Apollo Global Management",2,1,Europe,37.09024,-95.712891
888,Nxin,$1.08,2018,9/18/2018,China,Beijing,Internet software & services,"Beijing Juneng Hesheng Industry Investment Fund, Beijing Shuju Xinrong Fund",2,1,Asia,35.86166,104.195397
889,UISEE Technology,$1.08,2021,1/25/2021,China,Beijing,"Supply chain, logistics, & delivery","Shenzhen Capital Group, Robert Bosch Venture Capital, SeptWolves Ventures",3,1,Asia,35.86166,104.195397
890,56PINGTAI,$1.08,2021,1/25/2021,China,Shanghai,"Supply chain, logistics, & delivery","QF Capital, QC Capital, Unicom Innovation Venture Capital",3,1,Asia,35.86166,104.195397
891,Cirkul,$1.07,2022,6/13/2022,United States,Sarasota,Consumer & retail,"AF Ventures, Siddhi Capital, SC.Holdings",3,1,Europe,37.09024,-95.712891
892,Rubicon,$1.07,2017,8/25/2017,United States,Atlanta,Other,"Goldman Sachs, Leonardo DiCaprio, Promecap",3,1,Europe,37.09024,-95.712891
893,Radius Payment Solutions,$1.07,2017,11/27/2017,United Kingdom,Crewe,Fintech,Inflexion Private Equity,1,1,Asia,55.378051,-3.435973
894,Rivigo,$1.07,2019,11/07/2019,India,Gurgaon,"Supply chain, logistics, & delivery","SAIF Partners India, Warburg Pincus, Trifecta Capital Advisors",3,1,Asia,20.593684,78.96288
895,Mamaearth,$1.07,2021,12/28/2021,India,Gurgaon,E-commerce & direct-to-consumer,"Fireside Ventures, Sequoia Capital India, Stellaris Venture Partners",3,1,Asia,20.593684,78.96288
896,0x,$1.05,2022,4/26/2022,United States,San Francisco,Fintech,"Jump Capital, Pantera Capital, Greylock Partners",3,1,Europe,37.09024,-95.712891
897,Jiuxian,$1.05,2015,7/30/2015,China,Beijing,E-commerce & direct-to-consumer,"Sequoia Capital China, Rich Land Capital, Merrysunny Wealth",3,1,Asia,35.86166,104.195397
898,Instabase,$1.05,2019,10/21/2019,United States,San Francisco,Data management & analytics,"New Enterprise Associates, Greylock Partners, Andreessen Horowitz",3,1,Europe,37.09024,-95.712891
899,Sendbird,$1.05,2021,6/04/2021,United States,San Mateo,Mobile & telecommunications,"FundersClub, Y Combinator, Tiger Global Management",3,1,Europe,37.09024,-95.712891
900,Density,$1.05,2021,10/11/2021,United States,San Francisco,Hardware,"Founders Fund, Upfront Ventures, 	01 Advisors",3,1,Europe,37.09024,-95.712891
901,Mixpanel,$1.05,2021,11/15/2021,United States,San Francisco,Internet software & services,"Bain Capital Tech Opportunities, Andreessen Horowitz, Sequoia Capital",3,1,Europe,37.09024,-95.712891
902,Branch,$1.05,2022,1/03/2022,United States,Columbus,Fintech,"American Family Ventures, Greycroft, SignalFire",3,1,Europe,37.09024,-95.712891
903,Aprogen,$1.04,2019,5/31/2019,South Korea,Seongnam-Si,Health,"Lindeman Asia Investment, Nichi-Iko Pharmaceutical",2,1,0,35.907757,127.766922
904,OrCam Technologies,$1.03,2018,2/20/2018,Israel,Jerusalem,Artificial intelligence,"Intel Capital, Aviv Venture Capital",2,1,Asia,31.046051,34.851612
905,Ample,$1.02,2021,11/11/2021,United States,San Francisco,Hardware,"Shell Ventures, Blackstone, Moore Strategic Ventures",3,1,Europe,37.09024,-95.712891
906,Leap Motor,$1.01,2018,11/20/2018,China,Hangzhou,Auto & transportation,"Sequoia Capital China, Gopher Asset Management, Shanghai Electric Group",3,1,Asia,35.86166,104.195397
907,Wheel,$1.01,2022,1/19/2022,United States,Austin,Health,"Silverton Partners, Tusk Ventures, CRV",3,1,Europe,37.09024,-95.712891
908,Flow,$1,2022,8/15/2022,United States,New York,Fintech,Andreessen Horowitz,1,1,Europe,37.09024,-95.712891
909,Turntide Technologies,$1,2022,6/15/2022,United States,Sunnyvale,Auto & transportation,"Meson Capital Partners, Fifth Wall Ventures, OGCI Climate Investments",3,1,Europe,37.09024,-95.712891
910,EcoVadis,$1,2022,6/14/2022,France,Paris,"Supply chain, logistics, & delivery","Astorg Partners, Princeville Global, Beyond Net Zero",3,1,Europe,46.227638,2.213749
911,TransferMate,$1,2022,5/22/2022,Ireland,Kilkenny,Fintech,Railway Pension Trustee Co. Ltd.,1,1,Europe,53.41291,-8.24389
912,Lookout,$1,2013,10/10/2013,United States,San Francisco,Cybersecurity,"Accel Partners, Greylock Partners, Lowercase Capital",3,1,Europe,37.09024,-95.712891
913,Perimeter 81,$1,2022,6/06/2022,Israel,Tel Aviv,Cybersecurity,"Insight Partners, Toba Capital, Spring Ventures",3,1,Asia,31.046051,34.851612
914,Snapdeal,$1,2014,5/21/2014,India,New Delhi,E-commerce & direct-to-consumer,"SoftBankGroup, Blackrock, Alibaba Group",3,1,Asia,20.593684,78.96288
915,TechStyle Fashion Group,$1,2014,8/29/2014,United States,El Segundo,E-commerce & direct-to-consumer,"Matrix Partners, Passport Capital, Rho Ventures",3,1,Europe,37.09024,-95.712891
916,InMobi,$1,2014,2/12/2014,India,Bengaluru,Mobile & telecommunications,"Kleiner Perkins Caufield & Byers, Softbank Corp., Sherpalo Ventures",3,1,Asia,20.593684,78.96288
917,LinkSure Network,$1,2015,1/01/2015,China,Shanghai,Mobile & telecommunications,,1,1,Asia,35.86166,104.195397
918,Red Ventures,$1,2015,7/01/2015,United States,Fort Mill,Other,"Silver Lake Partners, General Atlantic",2,1,Europe,37.09024,-95.712891
919,BeiBei,$1,2015,1/22/2015,China,Hangzhou,E-commerce & direct-to-consumer,"Banyan Capital, New Horizon Capital, IDG Capital Partners",3,1,Asia,35.86166,104.195397
920,Lamabang,$1,2015,6/03/2015,China,Shenzhen,E-commerce & direct-to-consumer,"5Y Capital, Matrix Partners China, K2VC",3,1,Asia,35.86166,104.195397
921,JimuBox,$1,2015,4/21/2015,China,Beijing,Fintech,"Matrix Partners China, Ventech China, Shunwei Capital Partners",3,1,Asia,35.86166,104.195397
922,FXiaoKe,$1,2015,2/07/2015,China,Beijing,Mobile & telecommunications,"IDG Capital, Northern Light Venture Capital, DCM Ventures",3,1,Asia,35.86166,104.195397
923,Vox Media,$1,2015,12/08/2015,United States,Washington,Internet software & services,"Accel Partners, Comcast Ventures, General Atlantic",3,1,Europe,37.09024,-95.712891
924,Mia.com,$1,2015,8/09/2015,China,Beijing,E-commerce & direct-to-consumer,"Sequoia Capital China, ZhenFund, K2 Ventures",3,1,Asia,35.86166,104.195397
925,58 Daojia,$1,2015,12/10/2015,China,Beijing,Internet software & services,"KKR, Alibaba Group, Ping An Insurance",3,1,Asia,35.86166,104.195397
926,Womai,$1,2015,12/10/2015,China,Beijing,E-commerce & direct-to-consumer,"SAIF Partners China, Baidu, IDG Capital",3,1,Asia,35.86166,104.195397
927,HuJiang,$1,2015,10/29/2015,China,Shanghai,Edtech,"China Minsheng Investment, Baidu, Wanxin Media",3,1,Asia,35.86166,104.195397
928,iTutorGroup,$1,2015,11/18/2015,China,Shanghai,Edtech,"QiMing Venture Partners, Temasek Holdings, Silverlink Capital",3,1,Asia,35.86166,104.195397
929,MindMaze,$1,2016,1/28/2016,Switzerland,Lausanne,Health,Hinduja Group,1,1,Europe,46.818188,8.227512
930,iCarbonX,$1,2016,12/04/2016,China,Shenzhen,Artificial intelligence,"Tencent, Vcanbio",2,1,Asia,35.86166,104.195397
931,SMS Assist,$1,2016,7/06/2016,United States,Chicago,Internet software & services,"Goldman Sachs, Insights Venture Partners, Pritzker Group Venture Capital",3,1,Europe,37.09024,-95.712891
932,Kendra Scott,$1,2016,12/21/2016,United States,Austin,Consumer & retail,"Berkshire Partners, Norwest Venture Partners",2,1,Europe,37.09024,-95.712891
933,Mobvoi,$1,2017,6/04/2017,China,Beijing,Consumer & retail,"Sequoia Capital China, SIG Asia Investments, ZhenFund",3,1,Asia,35.86166,104.195397
934,Zhuan Zhuan,$1,2017,4/18/2017,China,Beijing,E-commerce & direct-to-consumer,"58.com, Tencent Holdings",2,1,Asia,35.86166,104.195397
935,Modernizing Medicine,$1,2017,10/05/2017,United States,Boca Raton,Health,"Warburg Pincus, Summit Partners, Sands Capital",3,1,Europe,37.09024,-95.712891
936,Zhaogang,$1,2017,6/29/2017,China,Shanghai,E-commerce & direct-to-consumer,"K2 Ventures, Matrix Partners China, IDG Capital",3,1,Asia,35.86166,104.195397
937,DianRong,$1,2017,2/08/2017,China,Shanghai,E-commerce & direct-to-consumer,"Standard Chartered, FinSight Ventures, Affirma Capital",3,1,Asia,35.86166,104.195397
938,Cell C,$1,2017,7/08/2017,South Africa,Midrand,Mobile & telecommunications,"Blue Label Telecoms, Net1 UEPS Technologies",2,1,Africa,-30.559482,22.937506
939,YH Global,$1,2017,9/21/2017,China,Shenzhen,"Supply chain, logistics, & delivery","Co-Energy Finance, Grandland",2,1,Asia,35.86166,104.195397
940,Revolution Precrafted,$1,2017,10/23/2017,Philippines,Manila,Other,"K2 Global, 500 Startups",2,1,Asia,12.879721,121.774017
941,WeLab,$1,2017,8/11/2017,Hong Kong,Fintech,"Sequoia Capital China, ING, Alibaba Entrepreneurs Fund",,1,1,Asia,22.396428,114.109497
942,Maimai,$1,2017,11/15/2017,China,Beijing,Mobile & telecommunications,"Morningside Venture Capital, IDG Capital, DCM Ventures",3,1,Asia,35.86166,104.195397
943,Dxy.cn,$1,2018,10/04/2018,China,Hangzhou,Health,"Tencent Holdings, DCM Ventures",2,1,Asia,35.86166,104.195397
944,HMD Global,$1,2018,5/21/2018,Finland,Espoo,Mobile & telecommunications,Ginko Ventures,1,1,Europe,61.92411,25.748151
945,Huike Group,$1,2018,5/24/2018,China,Beijing,Edtech,"Fosun RZ Capital, Oceanwide Holdings, Shenzhen Qianhe Capital Management Co.",3,1,Asia,35.86166,104.195397
946,China Cloud,$1,2018,11/06/2018,China,Wuxi,Hardware,"V Star Capital, GF Xinde Investment Management Co., Haitong Leading Capital Management",3,1,Asia,35.86166,104.195397
947,LinkDoc Technology,$1,2018,5/07/2018,China,Beijing,Health,"China Investment Corporation, New Enterprise Associates",2,1,Asia,35.86166,104.195397
948,MediaMath,$1,2018,10/07/2018,United States,New York,Internet software & services,"Silicon Valley Bank, QED Investors, European Founders Fund",3,1,Europe,37.09024,-95.712891
949,Movile,$1,2018,12/07/2018,Brazil,Sao Paulo,Mobile & telecommunications,"Innova Capital - FIP, 3G Capital Management, Prosus Ventures",3,1,Americas,-14.235004,-51.92528
950,Pat McGrath Labs,$1,2018,7/16/2018,United States,New York,Consumer & retail,"One Luxury Group, Eurazeo",2,1,Europe,37.09024,-95.712891
951,Wacai,$1,2018,7/18/2018,China,Hangzhou,Mobile & telecommunications,"Qiming Venture Partners, China Broadband Capital, CDH Investments",3,1,Asia,35.86166,104.195397
952,FlashEx,$1,2018,8/27/2018,China,Beijing,"Supply chain, logistics, & delivery","Prometheus Capital, Matrix Partners China, JD Capital Management",3,1,Asia,35.86166,104.195397
953,Banma Network Technologies,$1,2018,9/13/2018,China,Shanghai,Auto & transportation,"Yunfeng Capital, SDIC Innovation Investment Management, Shang Qi Capital",3,1,Asia,35.86166,104.195397
954,Tresata,$1,2018,10/10/2018,United States,Charlotte,Fintech,GCP Capital Partners,1,1,Europe,37.09024,-95.712891
955,Momenta,$1,2018,10/17/2018,China,Beijing,Artificial intelligence,"Sinovation Ventures, Tencent Holdings, Sequoia Capital China",3,1,Asia,35.86166,104.195397
956,Hosjoy,$1,2018,10/18/2018,China,Nanjing,E-commerce & direct-to-consumer,"U.S.-China Green Fund, Founder H Fund, Richland Equities",3,1,Asia,35.86166,104.195397
957,Omio,$1,2018,10/23/2018,Germany,Berlin,Travel,"Lakestar, Battery Ventures, New Enterprise Associates",3,1,Europe,51.165691,10.451526
958,TERMINUS Technology,$1,2018,10/25/2018,China,Beijing,Hardware,"China Everbright Limited, IDG Capital, iFLYTEK",3,1,Asia,35.86166,104.195397
959,BitFury,$1,2018,6/11/2018,Netherlands,Amsterdam,Hardware,"Georgian Co-Investment Fund, iTech Capital, Galaxy Digital",3,1,Europe,52.132633,5.291266
960,iFood,$1,2018,11/13/2018,Brazil,Osasco,"Supply chain, logistics, & delivery","Movile, Just Eat, Naspers",3,1,Americas,-14.235004,-51.92528
961,REEF Technology,$1,2018,10/12/2018,United States,Miami,"Supply chain, logistics, & delivery","Target Global, UBS Asset Management, Mubadala Capital",3,1,Europe,37.09024,-95.712891
962,Globality,$1,2019,1/22/2019,United States,Menlo Park,Artificial intelligence,SoftBank Group,1,1,Europe,37.09024,-95.712891
963,Ynsect,$1,2019,2/21/2019,France,Evry,Other,"Astanor Ventures, Upfront Ventures, IDInvest Partners",3,1,Europe,46.227638,2.213749
964,Intellifusion,$1,2019,3/22/2019,China,Shenzhen,Artificial intelligence,"BOC International, TopoScend Capital, Hongxiu VC",3,1,Asia,35.86166,104.195397
965,Poizon,$1,2019,4/29/2019,China,Shanghai,Mobile & telecommunications,"DST Global, Sequoia Capital China, Gaorong Capital",3,1,Asia,35.86166,104.195397
966,VTS,$1,2019,7/05/2019,United States,New York,Internet software & services,"Trinity Ventures, Fifth Wall Ventures, OpenView Venture Partners",3,1,Europe,37.09024,-95.712891
967,SITECH DEV,$1,2019,5/16/2019,China,Guiyang,Other,China Prosperity Capital,1,1,Asia,35.86166,104.195397
968,KnowBox,$1,2019,5/30/2019,China,Beijing,Edtech,"TAL Education Group, Legend Star, Alibaba Group",3,1,Asia,35.86166,104.195397
969,Yanolja,$1,2019,10/06/2019,South Korea,Seoul,Travel,"SBI Investment Korea, Partners Investment, GIC",3,1,0,35.907757,127.766922
970,Meero,$1,2019,6/18/2019,France,Paris,Artificial intelligence,"Aglae Ventures, Global Founders Capital, Alven Capital",3,1,Europe,46.227638,2.213749
971,Ibotta,$1,2019,6/08/2019,United States,Denver,Fintech,"Koch Disruptive Technologies, Teamworthy Ventures, GGV Capital",3,1,Europe,37.09024,-95.712891
972,C2FO,$1,2019,7/08/2019,United States,Leawood,Fintech,"Union Square Ventures, Summerhill Venture Partners, Mithril Capital Management",3,1,Europe,37.09024,-95.712891
973,Numbrs,$1,2019,8/22/2019,Switzerland,Zurich,Fintech,"Investment Corporation of Dubai, Centralway",2,1,Europe,46.818188,8.227512
974,EBANX,$1,2019,10/16/2019,Brazil,Curitiba,Fintech,"FTV Capital, Endeavor",2,1,Americas,-14.235004,-51.92528
975,KK Group,$3,2019,10/23/2019,China,Dongguan,E-commerce & direct-to-consumer,"Matrix Partners China, Bright Venture Capita, Shenzhen Capital Group",3,1,Asia,35.86166,104.195397
976,Alto Pharmacy,$1,2020,1/30/2020,United States,San Francisco,Health,"Jackson Square Ventures, Greenoaks Capital Management, Softbank Group",3,1,Europe,37.09024,-95.712891
